
*** Running vivado
    with args -log top.vdi -applog -m64 -messageDb vivado.pb -mode batch -source top.tcl -notrace


****** Vivado v2016.2 (64-bit)
  **** SW Build 1577090 on Thu Jun  2 16:32:40 MDT 2016
  **** IP Build 1577682 on Fri Jun  3 12:00:54 MDT 2016
    ** Copyright 1986-2016 Xilinx, Inc. All Rights Reserved.

source top.tcl -notrace
Design is defaulting to srcset: sources_1
Design is defaulting to constrset: constrs_1
INFO: [Netlist 29-17] Analyzing 2 Unisim elements for replacement
INFO: [Netlist 29-28] Unisim Transformation completed in 0 CPU seconds
INFO: [Project 1-479] Netlist was created with Vivado 2016.2
INFO: [Device 21-403] Loading part xc7a35tcpg236-1
INFO: [Project 1-570] Preparing netlist for logic optimization
Parsing XDC File [D:/Jack/NTHU/2018_spring/LD exp/Lab11/lab11_VGA_source/demo1/Basys3_Master.xdc]
Finished Parsing XDC File [D:/Jack/NTHU/2018_spring/LD exp/Lab11/lab11_VGA_source/demo1/Basys3_Master.xdc]
INFO: [Opt 31-138] Pushed 0 inverter(s) to 0 load pin(s).
INFO: [Project 1-111] Unisim Transformation Summary:
No Unisim elements were transformed.

link_design: Time (s): cpu = 00:00:07 ; elapsed = 00:00:08 . Memory (MB): peak = 444.133 ; gain = 237.512
INFO: [Vivado_Tcl 4-424] Cannot write hardware definition file as there are no IPI block design hardware handoff files present
Command: opt_design
Attempting to get a license for feature 'Implementation' and/or device 'xc7a35t'
INFO: [Common 17-349] Got license for feature 'Implementation' and/or device 'xc7a35t'
Running DRC as a precondition to command opt_design

Starting DRC Task
INFO: [DRC 23-27] Running DRC with 2 threads
INFO: [Project 1-461] DRC finished with 0 Errors
INFO: [Project 1-462] Please refer to the DRC report (report_drc) for more information.

Time (s): cpu = 00:00:00 ; elapsed = 00:00:00.317 . Memory (MB): peak = 449.531 ; gain = 5.398
INFO: [Timing 38-35] Done setting XDC timing constraints.

Starting Logic Optimization Task
Implement Debug Cores | Checksum: 1c957860b

Phase 1 Retarget
INFO: [Opt 31-138] Pushed 0 inverter(s) to 0 load pin(s).
INFO: [Opt 31-49] Retargeted 0 cell(s).
Phase 1 Retarget | Checksum: 1c957860b

Time (s): cpu = 00:00:00 ; elapsed = 00:00:00.196 . Memory (MB): peak = 920.867 ; gain = 0.000

Phase 2 Constant Propagation
INFO: [Opt 31-138] Pushed 0 inverter(s) to 0 load pin(s).
INFO: [Opt 31-10] Eliminated 0 cells.
Phase 2 Constant Propagation | Checksum: 1c957860b

Time (s): cpu = 00:00:00 ; elapsed = 00:00:00.264 . Memory (MB): peak = 920.867 ; gain = 0.000

Phase 3 Sweep
INFO: [Opt 31-12] Eliminated 0 unconnected nets.
INFO: [Opt 31-11] Eliminated 0 unconnected cells.
Phase 3 Sweep | Checksum: 1c957860b

Time (s): cpu = 00:00:00 ; elapsed = 00:00:00.293 . Memory (MB): peak = 920.867 ; gain = 0.000

Starting Connectivity Check Task

Time (s): cpu = 00:00:00 ; elapsed = 00:00:00.002 . Memory (MB): peak = 920.867 ; gain = 0.000
Ending Logic Optimization Task | Checksum: 1c957860b

Time (s): cpu = 00:00:00 ; elapsed = 00:00:00.335 . Memory (MB): peak = 920.867 ; gain = 0.000

Starting Power Optimization Task
INFO: [Pwropt 34-132] Skipping clock gating for clocks with a period < 2.00 ns.
Ending Power Optimization Task | Checksum: 1c957860b

Time (s): cpu = 00:00:00 ; elapsed = 00:00:00.084 . Memory (MB): peak = 920.867 ; gain = 0.000
INFO: [Common 17-83] Releasing license: Implementation
21 Infos, 0 Warnings, 0 Critical Warnings and 0 Errors encountered.
opt_design completed successfully
opt_design: Time (s): cpu = 00:00:13 ; elapsed = 00:00:16 . Memory (MB): peak = 920.867 ; gain = 476.734
Writing placer database...
Writing XDEF routing.
Writing XDEF routing logical nets.
Writing XDEF routing special nets.
Write XDEF Complete: Time (s): cpu = 00:00:01 ; elapsed = 00:00:00.126 . Memory (MB): peak = 920.867 ; gain = 0.000
INFO: [DRC 23-27] Running DRC with 2 threads
INFO: [Coretcl 2-168] The results of DRC are in file D:/Jack/NTHU/2018_spring/LD exp/Lab11/Lab11pre/Lab11pre.runs/impl_1/top_drc_opted.rpt.
INFO: [Chipscope 16-241] No debug cores found in the current design.
Before running the implement_debug_core command, either use the Set Up Debug wizard (GUI mode)
or use the create_debug_core and connect_debug_core Tcl commands to insert debug cores into the design.
Command: place_design
Attempting to get a license for feature 'Implementation' and/or device 'xc7a35t'
INFO: [Common 17-349] Got license for feature 'Implementation' and/or device 'xc7a35t'
INFO: [DRC 23-27] Running DRC with 2 threads
INFO: [Vivado_Tcl 4-198] DRC finished with 0 Errors
INFO: [Vivado_Tcl 4-199] Please refer to the DRC report (report_drc) for more information.
Running DRC as a precondition to command place_design
INFO: [DRC 23-27] Running DRC with 2 threads
INFO: [Vivado_Tcl 4-198] DRC finished with 0 Errors
INFO: [Vivado_Tcl 4-199] Please refer to the DRC report (report_drc) for more information.

Starting Placer Task
INFO: [Place 30-611] Multithreading enabled for place_design using a maximum of 2 CPUs

Phase 1 Placer Initialization
Netlist sorting complete. Time (s): cpu = 00:00:00 ; elapsed = 00:00:00 . Memory (MB): peak = 920.867 ; gain = 0.000
Netlist sorting complete. Time (s): cpu = 00:00:00 ; elapsed = 00:00:00.001 . Memory (MB): peak = 920.867 ; gain = 0.000

Phase 1.1 IO Placement/ Clock Placement/ Build Placer Device

Phase 1.1.1 ParallelPlaceIOClockAndInitTop

Phase 1.1.1.1 Pre-Place Cells
Phase 1.1.1.1 Pre-Place Cells | Checksum: 698e3709

Time (s): cpu = 00:00:00 ; elapsed = 00:00:00.112 . Memory (MB): peak = 920.867 ; gain = 0.000

Phase 1.1.1.2 Constructing HAPIClkRuleMgr
Phase 1.1.1.2 Constructing HAPIClkRuleMgr | Checksum: 698e3709

Time (s): cpu = 00:00:00 ; elapsed = 00:00:00.133 . Memory (MB): peak = 920.867 ; gain = 0.000
INFO: [Timing 38-35] Done setting XDC timing constraints.

Phase 1.1.1.3 IO and Clk Clean Up

Phase 1.1.1.3.1 Constructing HAPIClkRuleMgr
Phase 1.1.1.3.1 Constructing HAPIClkRuleMgr | Checksum: 698e3709

Time (s): cpu = 00:00:01 ; elapsed = 00:00:01 . Memory (MB): peak = 935.457 ; gain = 14.590
Phase 1.1.1.3 IO and Clk Clean Up | Checksum: 698e3709

Time (s): cpu = 00:00:01 ; elapsed = 00:00:01 . Memory (MB): peak = 935.457 ; gain = 14.590

Phase 1.1.1.4 Implementation Feasibility check On IDelay
Phase 1.1.1.4 Implementation Feasibility check On IDelay | Checksum: 698e3709

Time (s): cpu = 00:00:01 ; elapsed = 00:00:01 . Memory (MB): peak = 935.457 ; gain = 14.590

Phase 1.1.1.5 Commit IO Placement
Phase 1.1.1.5 Commit IO Placement | Checksum: fb4b8393

Time (s): cpu = 00:00:01 ; elapsed = 00:00:01 . Memory (MB): peak = 935.457 ; gain = 14.590
Phase 1.1.1 ParallelPlaceIOClockAndInitTop | Checksum: fb4b8393

Time (s): cpu = 00:00:01 ; elapsed = 00:00:01 . Memory (MB): peak = 935.457 ; gain = 14.590
Phase 1.1 IO Placement/ Clock Placement/ Build Placer Device | Checksum: 11e044fff

Time (s): cpu = 00:00:01 ; elapsed = 00:00:01 . Memory (MB): peak = 935.457 ; gain = 14.590

Phase 1.2 Build Placer Netlist Model

Phase 1.2.1 Place Init Design

Phase 1.2.1.1 Make Others
Phase 1.2.1.1 Make Others | Checksum: 132b9e370

Time (s): cpu = 00:00:01 ; elapsed = 00:00:02 . Memory (MB): peak = 935.457 ; gain = 14.590

Phase 1.2.1.2 Init Lut Pin Assignment
Phase 1.2.1.2 Init Lut Pin Assignment | Checksum: 132b9e370

Time (s): cpu = 00:00:01 ; elapsed = 00:00:02 . Memory (MB): peak = 935.457 ; gain = 14.590
Phase 1.2.1 Place Init Design | Checksum: 18767b10c

Time (s): cpu = 00:00:01 ; elapsed = 00:00:02 . Memory (MB): peak = 935.457 ; gain = 14.590
Phase 1.2 Build Placer Netlist Model | Checksum: 18767b10c

Time (s): cpu = 00:00:01 ; elapsed = 00:00:02 . Memory (MB): peak = 935.457 ; gain = 14.590

Phase 1.3 Constrain Clocks/Macros
Phase 1.3 Constrain Clocks/Macros | Checksum: 18767b10c

Time (s): cpu = 00:00:01 ; elapsed = 00:00:02 . Memory (MB): peak = 935.457 ; gain = 14.590
Phase 1 Placer Initialization | Checksum: 18767b10c

Time (s): cpu = 00:00:01 ; elapsed = 00:00:02 . Memory (MB): peak = 935.457 ; gain = 14.590

Phase 2 Global Placement
Phase 2 Global Placement | Checksum: 1fea19c36

Time (s): cpu = 00:00:01 ; elapsed = 00:00:02 . Memory (MB): peak = 935.457 ; gain = 14.590

Phase 3 Detail Placement

Phase 3.1 Commit Multi Column Macros
Phase 3.1 Commit Multi Column Macros | Checksum: 1fea19c36

Time (s): cpu = 00:00:01 ; elapsed = 00:00:02 . Memory (MB): peak = 935.457 ; gain = 14.590

Phase 3.2 Commit Most Macros & LUTRAMs
Phase 3.2 Commit Most Macros & LUTRAMs | Checksum: 21a40c178

Time (s): cpu = 00:00:01 ; elapsed = 00:00:02 . Memory (MB): peak = 935.457 ; gain = 14.590

Phase 3.3 Area Swap Optimization
Phase 3.3 Area Swap Optimization | Checksum: 1bdae5f2f

Time (s): cpu = 00:00:02 ; elapsed = 00:00:02 . Memory (MB): peak = 935.457 ; gain = 14.590

Phase 3.4 updateClock Trees: DP
Phase 3.4 updateClock Trees: DP | Checksum: 1bdae5f2f

Time (s): cpu = 00:00:02 ; elapsed = 00:00:02 . Memory (MB): peak = 935.457 ; gain = 14.590

Phase 3.5 Timing Path Optimizer
Phase 3.5 Timing Path Optimizer | Checksum: 1a0cda716

Time (s): cpu = 00:00:02 ; elapsed = 00:00:02 . Memory (MB): peak = 935.457 ; gain = 14.590

Phase 3.6 Fast Optimization
Phase 3.6 Fast Optimization | Checksum: 1a0cda716

Time (s): cpu = 00:00:02 ; elapsed = 00:00:02 . Memory (MB): peak = 935.457 ; gain = 14.590

Phase 3.7 Small Shape Detail Placement
Phase 3.7 Small Shape Detail Placement | Checksum: 12567bee1

Time (s): cpu = 00:00:02 ; elapsed = 00:00:03 . Memory (MB): peak = 935.457 ; gain = 14.590

Phase 3.8 Re-assign LUT pins
Phase 3.8 Re-assign LUT pins | Checksum: d7da2d1b

Time (s): cpu = 00:00:02 ; elapsed = 00:00:03 . Memory (MB): peak = 935.457 ; gain = 14.590

Phase 3.9 Pipeline Register Optimization
Phase 3.9 Pipeline Register Optimization | Checksum: d7da2d1b

Time (s): cpu = 00:00:02 ; elapsed = 00:00:03 . Memory (MB): peak = 935.457 ; gain = 14.590

Phase 3.10 Fast Optimization
Phase 3.10 Fast Optimization | Checksum: d7da2d1b

Time (s): cpu = 00:00:02 ; elapsed = 00:00:03 . Memory (MB): peak = 935.457 ; gain = 14.590
Phase 3 Detail Placement | Checksum: d7da2d1b

Time (s): cpu = 00:00:02 ; elapsed = 00:00:03 . Memory (MB): peak = 935.457 ; gain = 14.590

Phase 4 Post Placement Optimization and Clean-Up

Phase 4.1 Post Commit Optimization
INFO: [Timing 38-35] Done setting XDC timing constraints.

Phase 4.1.1 updateClock Trees: PCOPT
Phase 4.1.1 updateClock Trees: PCOPT | Checksum: 1a79e947b

Time (s): cpu = 00:00:02 ; elapsed = 00:00:03 . Memory (MB): peak = 935.457 ; gain = 14.590

Phase 4.1.2 Post Placement Optimization
INFO: [Place 30-746] Post Placement Timing Summary WNS=8.401. For the most accurate timing information please run report_timing.
Phase 4.1.2 Post Placement Optimization | Checksum: 17ec026e7

Time (s): cpu = 00:00:02 ; elapsed = 00:00:03 . Memory (MB): peak = 935.457 ; gain = 14.590
Phase 4.1 Post Commit Optimization | Checksum: 17ec026e7

Time (s): cpu = 00:00:02 ; elapsed = 00:00:03 . Memory (MB): peak = 935.457 ; gain = 14.590

Phase 4.2 Sweep Clock Roots: Post-Placement
Phase 4.2 Sweep Clock Roots: Post-Placement | Checksum: 17ec026e7

Time (s): cpu = 00:00:02 ; elapsed = 00:00:03 . Memory (MB): peak = 935.457 ; gain = 14.590

Phase 4.3 Uram Pipeline Register Optimization
Phase 4.3 Uram Pipeline Register Optimization | Checksum: 17ec026e7

Time (s): cpu = 00:00:02 ; elapsed = 00:00:03 . Memory (MB): peak = 935.457 ; gain = 14.590

Phase 4.4 Post Placement Cleanup
Phase 4.4 Post Placement Cleanup | Checksum: 17ec026e7

Time (s): cpu = 00:00:02 ; elapsed = 00:00:03 . Memory (MB): peak = 935.457 ; gain = 14.590

Phase 4.5 Placer Reporting
Phase 4.5 Placer Reporting | Checksum: 17ec026e7

Time (s): cpu = 00:00:02 ; elapsed = 00:00:03 . Memory (MB): peak = 935.457 ; gain = 14.590

Phase 4.6 Final Placement Cleanup
Phase 4.6 Final Placement Cleanup | Checksum: 16c61d571

Time (s): cpu = 00:00:02 ; elapsed = 00:00:03 . Memory (MB): peak = 935.457 ; gain = 14.590
Phase 4 Post Placement Optimization and Clean-Up | Checksum: 16c61d571

Time (s): cpu = 00:00:02 ; elapsed = 00:00:03 . Memory (MB): peak = 935.457 ; gain = 14.590
Ending Placer Task | Checksum: 145629cbb

Time (s): cpu = 00:00:02 ; elapsed = 00:00:03 . Memory (MB): peak = 935.457 ; gain = 14.590
INFO: [Common 17-83] Releasing license: Implementation
36 Infos, 0 Warnings, 0 Critical Warnings and 0 Errors encountered.
place_design completed successfully
Writing placer database...
Writing XDEF routing.
Writing XDEF routing logical nets.
Writing XDEF routing special nets.
Write XDEF Complete: Time (s): cpu = 00:00:00 ; elapsed = 00:00:00.050 . Memory (MB): peak = 935.457 ; gain = 0.000
report_io: Time (s): cpu = 00:00:00 ; elapsed = 00:00:00.093 . Memory (MB): peak = 935.457 ; gain = 0.000
report_utilization: Time (s): cpu = 00:00:00 ; elapsed = 00:00:00.031 . Memory (MB): peak = 935.457 ; gain = 0.000
report_control_sets: Time (s): cpu = 00:00:00 ; elapsed = 00:00:00.001 . Memory (MB): peak = 935.457 ; gain = 0.000
Command: route_design
Attempting to get a license for feature 'Implementation' and/or device 'xc7a35t'
INFO: [Common 17-349] Got license for feature 'Implementation' and/or device 'xc7a35t'
Running DRC as a precondition to command route_design
INFO: [DRC 23-27] Running DRC with 2 threads
INFO: [Vivado_Tcl 4-198] DRC finished with 0 Errors
INFO: [Vivado_Tcl 4-199] Please refer to the DRC report (report_drc) for more information.


Starting Routing Task
INFO: [Route 35-254] Multithreading enabled for route_design using a maximum of 2 CPUs
Checksum: PlaceDB: ac3e8409 ConstDB: 0 ShapeSum: 992418b2 RouteDB: 0

Phase 1 Build RT Design
Phase 1 Build RT Design | Checksum: 1486980f8

Time (s): cpu = 00:00:37 ; elapsed = 00:00:36 . Memory (MB): peak = 1039.945 ; gain = 104.488

Phase 2 Router Initialization

Phase 2.1 Create Timer
Phase 2.1 Create Timer | Checksum: 1486980f8

Time (s): cpu = 00:00:37 ; elapsed = 00:00:36 . Memory (MB): peak = 1039.945 ; gain = 104.488

Phase 2.2 Fix Topology Constraints
Phase 2.2 Fix Topology Constraints | Checksum: 1486980f8

Time (s): cpu = 00:00:37 ; elapsed = 00:00:36 . Memory (MB): peak = 1039.945 ; gain = 104.488

Phase 2.3 Pre Route Cleanup
Phase 2.3 Pre Route Cleanup | Checksum: 1486980f8

Time (s): cpu = 00:00:37 ; elapsed = 00:00:36 . Memory (MB): peak = 1039.945 ; gain = 104.488
 Number of Nodes with overlaps = 0

Phase 2.4 Update Timing
Phase 2.4 Update Timing | Checksum: 1f2222ca1

Time (s): cpu = 00:00:38 ; elapsed = 00:00:36 . Memory (MB): peak = 1039.945 ; gain = 104.488
INFO: [Route 35-416] Intermediate Timing Summary | WNS=8.369  | TNS=0.000  | WHS=0.005  | THS=0.000  |

Phase 2 Router Initialization | Checksum: 19bba7575

Time (s): cpu = 00:00:38 ; elapsed = 00:00:36 . Memory (MB): peak = 1039.945 ; gain = 104.488

Phase 3 Initial Routing
Phase 3 Initial Routing | Checksum: 6a35c35a

Time (s): cpu = 00:00:38 ; elapsed = 00:00:37 . Memory (MB): peak = 1039.945 ; gain = 104.488

Phase 4 Rip-up And Reroute

Phase 4.1 Global Iteration 0
 Number of Nodes with overlaps = 6
 Number of Nodes with overlaps = 0

Phase 4.1.1 Update Timing
Phase 4.1.1 Update Timing | Checksum: 249a17119

Time (s): cpu = 00:00:38 ; elapsed = 00:00:37 . Memory (MB): peak = 1039.945 ; gain = 104.488
INFO: [Route 35-416] Intermediate Timing Summary | WNS=8.115  | TNS=0.000  | WHS=N/A    | THS=N/A    |

Phase 4.1 Global Iteration 0 | Checksum: 249a17119

Time (s): cpu = 00:00:38 ; elapsed = 00:00:37 . Memory (MB): peak = 1039.945 ; gain = 104.488
Phase 4 Rip-up And Reroute | Checksum: 249a17119

Time (s): cpu = 00:00:38 ; elapsed = 00:00:37 . Memory (MB): peak = 1039.945 ; gain = 104.488

Phase 5 Delay and Skew Optimization

Phase 5.1 Delay CleanUp

Phase 5.1.1 Update Timing
Phase 5.1.1 Update Timing | Checksum: 286603574

Time (s): cpu = 00:00:38 ; elapsed = 00:00:37 . Memory (MB): peak = 1039.945 ; gain = 104.488
INFO: [Route 35-416] Intermediate Timing Summary | WNS=8.208  | TNS=0.000  | WHS=N/A    | THS=N/A    |

Phase 5.1 Delay CleanUp | Checksum: 286603574

Time (s): cpu = 00:00:38 ; elapsed = 00:00:37 . Memory (MB): peak = 1039.945 ; gain = 104.488

Phase 5.2 Clock Skew Optimization
Phase 5.2 Clock Skew Optimization | Checksum: 286603574

Time (s): cpu = 00:00:38 ; elapsed = 00:00:37 . Memory (MB): peak = 1039.945 ; gain = 104.488
Phase 5 Delay and Skew Optimization | Checksum: 286603574

Time (s): cpu = 00:00:38 ; elapsed = 00:00:37 . Memory (MB): peak = 1039.945 ; gain = 104.488

Phase 6 Post Hold Fix

Phase 6.1 Hold Fix Iter

Phase 6.1.1 Update Timing
Phase 6.1.1 Update Timing | Checksum: 1b922874f

Time (s): cpu = 00:00:38 ; elapsed = 00:00:37 . Memory (MB): peak = 1039.945 ; gain = 104.488
INFO: [Route 35-416] Intermediate Timing Summary | WNS=8.208  | TNS=0.000  | WHS=0.464  | THS=0.000  |

Phase 6.1 Hold Fix Iter | Checksum: 1b922874f

Time (s): cpu = 00:00:38 ; elapsed = 00:00:37 . Memory (MB): peak = 1039.945 ; gain = 104.488
Phase 6 Post Hold Fix | Checksum: 1b922874f

Time (s): cpu = 00:00:38 ; elapsed = 00:00:37 . Memory (MB): peak = 1039.945 ; gain = 104.488

Phase 7 Route finalize

Router Utilization Summary
  Global Vertical Routing Utilization    = 0.00869011 %
  Global Horizontal Routing Utilization  = 0.00871942 %
  Routable Net Status*
  *Does not include unroutable nets such as driverless and loadless.
  Run report_route_status for detailed report.
  Number of Failed Nets               = 0
  Number of Unrouted Nets             = 0
  Number of Partially Routed Nets     = 0
  Number of Node Overlaps             = 0

Phase 7 Route finalize | Checksum: 1b922874f

Time (s): cpu = 00:00:38 ; elapsed = 00:00:37 . Memory (MB): peak = 1039.945 ; gain = 104.488

Phase 8 Verifying routed nets

 Verification completed successfully
Phase 8 Verifying routed nets | Checksum: 1b922874f

Time (s): cpu = 00:00:38 ; elapsed = 00:00:37 . Memory (MB): peak = 1039.945 ; gain = 104.488

Phase 9 Depositing Routes
Phase 9 Depositing Routes | Checksum: 173597a69

Time (s): cpu = 00:00:38 ; elapsed = 00:00:37 . Memory (MB): peak = 1039.945 ; gain = 104.488

Phase 10 Post Router Timing
INFO: [Route 35-57] Estimated Timing Summary | WNS=8.208  | TNS=0.000  | WHS=0.464  | THS=0.000  |

INFO: [Route 35-327] The final timing numbers are based on the router estimated timing analysis. For a complete and accurate timing signoff, please run report_timing_summary.
Phase 10 Post Router Timing | Checksum: 173597a69

Time (s): cpu = 00:00:38 ; elapsed = 00:00:37 . Memory (MB): peak = 1039.945 ; gain = 104.488
INFO: [Route 35-16] Router Completed Successfully

Time (s): cpu = 00:00:38 ; elapsed = 00:00:37 . Memory (MB): peak = 1039.945 ; gain = 104.488

Routing Is Done.
INFO: [Common 17-83] Releasing license: Implementation
49 Infos, 0 Warnings, 0 Critical Warnings and 0 Errors encountered.
route_design completed successfully
route_design: Time (s): cpu = 00:00:39 ; elapsed = 00:00:37 . Memory (MB): peak = 1039.945 ; gain = 104.488
Writing placer database...
Writing XDEF routing.
Writing XDEF routing logical nets.
Writing XDEF routing special nets.
Write XDEF Complete: Time (s): cpu = 00:00:00 ; elapsed = 00:00:00.099 . Memory (MB): peak = 1039.945 ; gain = 0.000
INFO: [DRC 23-27] Running DRC with 2 threads
INFO: [Coretcl 2-168] The results of DRC are in file D:/Jack/NTHU/2018_spring/LD exp/Lab11/Lab11pre/Lab11pre.runs/impl_1/top_drc_routed.rpt.
INFO: [Timing 38-91] UpdateTimingParams: Speed grade: -1, Delay Type: min_max.
INFO: [Timing 38-191] Multithreading enabled for timing update using a maximum of 2 CPUs
Running Vector-less Activity Propagation...

Finished Running Vector-less Activity Propagation
Attempting to get a license for feature 'Implementation' and/or device 'xc7a35t'
INFO: [Common 17-349] Got license for feature 'Implementation' and/or device 'xc7a35t'
Running DRC as a precondition to command write_bitstream
INFO: [DRC 23-27] Running DRC with 2 threads
INFO: [Vivado 12-3199] DRC finished with 0 Errors
INFO: [Vivado 12-3200] Please refer to the DRC report (report_drc) for more information.
INFO: [Designutils 20-2272] Running write_bitstream with 2 threads.
Loading data files...
Loading site data...
Loading route data...
Processing options...
Creating bitmap...
Creating bitstream...
Bitstream compression saved 15741856 bits.
Writing bitstream ./top.bit...
INFO: [Vivado 12-1842] Bitgen Completed Successfully.
INFO: [Project 1-120] WebTalk data collection is mandatory when using a WebPACK part without a full Vivado license. To see the specific WebTalk data collected for your design, open the usage_statistics_webtalk.html or usage_statistics_webtalk.xml file in the implementation directory.
存取被拒。
存取被拒。
INFO: [Common 17-83] Releasing license: Implementation
write_bitstream: Time (s): cpu = 00:00:15 ; elapsed = 00:00:16 . Memory (MB): peak = 1376.637 ; gain = 336.691
INFO: [Vivado_Tcl 4-395] Unable to parse hwdef file top.hwdef
INFO: [Common 17-206] Exiting Vivado at Mon May 21 21:19:44 2018...
